{
    "$schema": "https://json-schema.org/draft/2020-12/schema",
    "$id": "https://skyrising.github.io/mc-versions/schemas/version.json",
    "$defs": {
        "version": {
            "description": "A version in the Omniarchive format",
            "type": "string",
            "pattern": "^(((server-)?([abc]|inf?-|rd-|af-)?[0-9]+[.0-9]*)|[0-9]{2}w[0-9]{2}[a-z~])a?([_-][0-9a-z]+)*$"
        },
        "semver": {
            "description": "A version number in SemVer format (see https://semver.org/ for the specification)",
            "type": "string",
            "pattern": "^(0|[1-9]\\d*)\\.(0|[1-9]\\d*)\\.(0|[1-9]\\d*)(?:-((?:0|[1-9]\\d*|\\d*[a-zA-Z-][0-9a-zA-Z-]*)(?:\\.(?:0|[1-9]\\d*|\\d*[a-zA-Z-][0-9a-zA-Z-]*))*))?(?:\\+([0-9a-zA-Z-]+(?:\\.[0-9a-zA-Z-]+)*))?$"
        },
        "releaseType": {
            "description": "A release type (e.g. release, snapshot, etc.)",
            "type": "string",
            "pattern": "^[a-z_]+$",
            "examples": ["release", "snapshot", "old_alpha", "old_beta"]
        },
        "sha1": {
            "description": "The SHA-1 hash of a file",
            "type": "string",
            "pattern": "^[0-9a-f]{40}$"
        },
        "downloadInfo": {
            "type": "object",
            "properties": {
                "sha1": {"$ref": "#/$defs/sha1"},
                "size": {"type": "integer", "minimum": 0},
                "url": {"type": "string", "format": "uri"}
            },
            "additionalProperties": false
        },
        "protocolVersion": {
            "type": "object",
            "properties": {
                "type": {"enum": ["classic", "modern", "netty", "netty-snapshot"]},
                "version": {"type": "integer", "minimum": 0}
            },
            "required": ["type", "version"],
            "additionalProperties": false
        },
        "worldFormat": {
            "type": "object",
            "properties": {
                "format": {"enum": ["alpha", "region", "anvil"]},
                "version": {"type": "integer"}
            },
            "required": ["format"],
            "additionalProperties": false
        },
        "manifestInfo": {
            "type": "object",
            "properties": {
                "assetHash": {"$ref": "#/$defs/sha1"},
                "assetIndex": {"type": "string"},
                "downloads": {"$ref": "#/$defs/sha1"},
                "downloadsId": {"type": "integer", "minimum": 1},
                "hash": {"$ref": "#/$defs/sha1"},
                "time": {"type": "string", "format": "date-time"},
                "type": {"$ref": "#/$defs/releaseType"},
                "url": {"type": "string", "format": "uri-reference"}
            }
        }
    },
    "type": "object",
    "properties": {
        "id": {"$ref": "#/$defs/version"},
        "client": {
            "type": "boolean",
            "description": "Whether `downloads` includes a client"
        },
        "server": {
            "type": "boolean",
            "description": "Whether `downloads` includes a server"
        },
        "sharedMappings": {
            "type": "boolean",
            "description": "Whether the obfuscation mappings for client and server are the same"
        },
        "downloads": {
            "patternProperties": {
                "^[a-z_]*$": {"$ref": "#/$defs/downloadInfo"}
            },
            "additionalProperties": false
        },
        "manifests": {
            "type": "array",
            "items": {"$ref": "#/$defs/manifestInfo"}
        },
        "normalizedVersion": {"$ref": "#/$defs/semver"},
        "previous": {"type": "array", "items": {"$ref": "#/$defs/version"}},
        "next": {"type": "array", "items": {"$ref": "#/$defs/version"}},
        "releaseTarget": {"$ref": "#/$defs/semver"},
        "releaseTime": {"type": "string", "format": "date-time"},
        "protocol": {
            "oneOf": [{
                "type": "object",
                "properties": {
                    "type": {"enum": ["classic", "modern", "netty", "netty-snapshot"]},
                    "version": {"type": "integer", "minimum": 0}
                },
                "required": ["type", "version"],
                "additionalProperties": false
            }, {
                "type": "null"
            }]
        },
        "world": {"$ref": "#/$defs/worldFormat"}
    },
    "required": ["id", "client", "server", "downloads", "normalizedVersion", "previous", "next", "releaseTarget", "releaseTime", "protocol", "world"]
}