{
  "$schema": "https://skyrising.github.io/mc-versions/schemas/version.json",
  "client": true,
  "downloads": {
    "client": {
      "sha1": "78ed8d3359453614d8f69bd982111e8aa6c8f612",
      "size": 11163926,
      "url": "https://launcher.mojang.com/v1/objects/78ed8d3359453614d8f69bd982111e8aa6c8f612/client.jar"
    },
    "server": {
      "sha1": "4e47158fd42d966884a7ffb7440b35d86c038049",
      "size": 31117130,
      "url": "https://launcher.mojang.com/v1/objects/4e47158fd42d966884a7ffb7440b35d86c038049/server.jar"
    }
  },
  "id": "18w06a",
  "manifests": [
    {
      "assetHash": "23981354446ddc141dcf03cc4bfa6b2a9492aa90",
      "assetIndex": "1.13",
      "downloads": "510c548ea983b80d76b0ae112c209865fdd8d7ff",
      "downloadsId": 1,
      "hash": "cbf797f54c85ca183be91b7879f95e46b402f7db",
      "time": "2018-02-09T12:09:55+00:00",
      "type": "snapshot",
      "url": "../manifest/c/b/f797f54c85ca183be91b7879f95e46b402f7db/18w06a.json"
    },
    {
      "assetHash": "23981354446ddc141dcf03cc4bfa6b2a9492aa90",
      "assetIndex": "1.13",
      "downloads": "510c548ea983b80d76b0ae112c209865fdd8d7ff",
      "downloadsId": 1,
      "hash": "9a1741a1f4c3d0030aed23d5766539a806052cc3",
      "time": "2018-02-09T12:09:55+00:00",
      "type": "snapshot",
      "url": "../manifest/9/a/1741a1f4c3d0030aed23d5766539a806052cc3/18w06a.json"
    },
    {
      "assetHash": "23981354446ddc141dcf03cc4bfa6b2a9492aa90",
      "assetIndex": "1.13",
      "downloads": "510c548ea983b80d76b0ae112c209865fdd8d7ff",
      "downloadsId": 1,
      "hash": "8b46d50661a17a22ecb5166f6822fb94ed1dc2c9",
      "time": "2018-02-09T12:09:55+00:00",
      "type": "snapshot",
      "url": "../manifest/8/b/46d50661a17a22ecb5166f6822fb94ed1dc2c9/18w06a.json"
    },
    {
      "assetHash": "23981354446ddc141dcf03cc4bfa6b2a9492aa90",
      "assetIndex": "1.13",
      "downloads": "510c548ea983b80d76b0ae112c209865fdd8d7ff",
      "downloadsId": 1,
      "hash": "356ebf067ef74aa437bd9849ebb2dd36df7ab54b",
      "time": "2018-02-09T12:09:55+00:00",
      "type": "snapshot",
      "url": "../manifest/3/5/6ebf067ef74aa437bd9849ebb2dd36df7ab54b/18w06a.json"
    }
  ],
  "next": [
    "18w07a"
  ],
  "normalizedVersion": "1.13.0-alpha.18.6.a",
  "previous": [
    "18w05a"
  ],
  "protocol": {
    "type": "netty",
    "version": 357
  },
  "releaseTarget": "1.13",
  "releaseTime": "2018-02-09T12:09:55+00:00",
  "server": true,
  "sharedMappings": true,
  "world": {
    "format": "anvil",
    "version": 1466
  }
}