{
  "client": true,
  "downloads": {
    "client": {
      "sha1": "d9b4fc98eb5242346ed0421f6ccd3c9032dc0514",
      "size": 11838478,
      "url": "https://launcher.mojang.com/v1/objects/d9b4fc98eb5242346ed0421f6ccd3c9032dc0514/client.jar"
    },
    "server": {
      "sha1": "85d6445fc4596e6b69fb00f0d3e5462dfeeb933c",
      "size": 31534189,
      "url": "https://launcher.mojang.com/v1/objects/85d6445fc4596e6b69fb00f0d3e5462dfeeb933c/server.jar"
    }
  },
  "id": "18w14b",
  "manifests": [
    {
      "assetHash": "23981354446ddc141dcf03cc4bfa6b2a9492aa90",
      "assetIndex": "1.13",
      "downloads": "2fcc4f9f749990434ddd23fe92785c1596cc8a8c",
      "downloadsId": 1,
      "hash": "4cafabaf5351a4df5d398b60fbd99c310b1671ec",
      "lastModified": "2021-12-15T15:56:01+00:00",
      "time": "2018-04-05T14:44:02+00:00",
      "type": "snapshot",
      "url": "../manifest/4/c/afabaf5351a4df5d398b60fbd99c310b1671ec/18w14b.json"
    },
    {
      "assetHash": "23981354446ddc141dcf03cc4bfa6b2a9492aa90",
      "assetIndex": "1.13",
      "downloads": "2fcc4f9f749990434ddd23fe92785c1596cc8a8c",
      "downloadsId": 1,
      "hash": "b1a318d1d40fa24283e0eeb1ab42b9a9f6251709",
      "lastModified": "2021-12-10T03:02:04+00:00",
      "time": "2018-04-05T14:44:02+00:00",
      "type": "snapshot",
      "url": "../manifest/b/1/a318d1d40fa24283e0eeb1ab42b9a9f6251709/18w14b.json"
    },
    {
      "assetHash": "23981354446ddc141dcf03cc4bfa6b2a9492aa90",
      "assetIndex": "1.13",
      "downloads": "2fcc4f9f749990434ddd23fe92785c1596cc8a8c",
      "downloadsId": 1,
      "hash": "9c7b593ae032fca813c6c81feb25fce1d64be5f6",
      "lastModified": "2021-07-07T13:59:39+00:00",
      "time": "2018-04-05T14:44:02+00:00",
      "type": "snapshot",
      "url": "../manifest/9/c/7b593ae032fca813c6c81feb25fce1d64be5f6/18w14b.json"
    },
    {
      "assetHash": "23981354446ddc141dcf03cc4bfa6b2a9492aa90",
      "assetIndex": "1.13",
      "downloads": "2fcc4f9f749990434ddd23fe92785c1596cc8a8c",
      "downloadsId": 1,
      "hash": "baf7f6dab46c6678111137baa9431c7e278ea5c8",
      "lastModified": "2018-08-29T12:59:04+00:00",
      "time": "2018-04-05T14:44:02+00:00",
      "type": "snapshot",
      "url": "../manifest/b/a/f7f6dab46c6678111137baa9431c7e278ea5c8/18w14b.json"
    }
  ],
  "next": [
    "18w15a"
  ],
  "normalizedVersion": "1.13.0-alpha.18.14.b",
  "previous": [
    "18w14a"
  ],
  "protocol": {
    "type": "netty",
    "version": 370
  },
  "releaseTarget": "1.13",
  "releaseTime": "2018-04-05T14:44:02+00:00",
  "server": true,
  "sharedMappings": true,
  "world": {
    "format": "anvil",
    "version": 1481
  }
}