{
  "$schema": "https://skyrising.github.io/mc-versions/schemas/version.json",
  "client": true,
  "downloads": {
    "client": {
      "sha1": "72c4fbff2a1318a57bfb66e325055064a13378a8",
      "size": 16031164,
      "url": "https://launcher.mojang.com/v1/objects/72c4fbff2a1318a57bfb66e325055064a13378a8/client.jar"
    },
    "server": {
      "sha1": "2ffcae7a9489d515b0f733430923ef974dffd56b",
      "size": 32642829,
      "url": "https://launcher.mojang.com/v1/objects/2ffcae7a9489d515b0f733430923ef974dffd56b/server.jar"
    }
  },
  "id": "1.13-pre10",
  "manifests": [
    {
      "assetHash": "23981354446ddc141dcf03cc4bfa6b2a9492aa90",
      "assetIndex": "1.13",
      "downloads": "826e6eb882196b7c7359611ea9e9f03594a51e23",
      "downloadsId": 1,
      "hash": "89a639b68be27cbe45c6ced76709f9fc45587108",
      "time": "2018-07-17T14:48:06+00:00",
      "type": "snapshot",
      "url": "../manifest/8/9/a639b68be27cbe45c6ced76709f9fc45587108/1.13-pre10.json"
    },
    {
      "assetHash": "23981354446ddc141dcf03cc4bfa6b2a9492aa90",
      "assetIndex": "1.13",
      "downloads": "826e6eb882196b7c7359611ea9e9f03594a51e23",
      "downloadsId": 1,
      "hash": "7f30e477206515105544b66213b254ccab74706e",
      "time": "2018-07-17T14:48:06+00:00",
      "type": "snapshot",
      "url": "../manifest/7/f/30e477206515105544b66213b254ccab74706e/1.13-pre10.json"
    },
    {
      "assetHash": "23981354446ddc141dcf03cc4bfa6b2a9492aa90",
      "assetIndex": "1.13",
      "downloads": "826e6eb882196b7c7359611ea9e9f03594a51e23",
      "downloadsId": 1,
      "hash": "3cdff1f50c26eb83666f7ee35f7624c236bc7124",
      "time": "2018-07-17T14:48:06+00:00",
      "type": "snapshot",
      "url": "../manifest/3/c/dff1f50c26eb83666f7ee35f7624c236bc7124/1.13-pre10.json"
    },
    {
      "assetHash": "23981354446ddc141dcf03cc4bfa6b2a9492aa90",
      "assetIndex": "1.13",
      "downloads": "826e6eb882196b7c7359611ea9e9f03594a51e23",
      "downloadsId": 1,
      "hash": "19f5b3ba211fbe9649f8cde8294a62ac86925655",
      "time": "2018-07-17T14:48:06+00:00",
      "type": "snapshot",
      "url": "../manifest/1/9/f5b3ba211fbe9649f8cde8294a62ac86925655/1.13-pre10.json"
    }
  ],
  "next": [
    "1.13"
  ],
  "normalizedVersion": "1.13.0-pre.10",
  "previous": [
    "1.13-pre9"
  ],
  "protocol": {
    "type": "netty",
    "version": 392
  },
  "releaseTarget": "1.13",
  "releaseTime": "2018-07-17T14:48:06+00:00",
  "server": true,
  "sharedMappings": true,
  "world": {
    "format": "anvil",
    "version": 1518
  }
}