{
  "$schema": "https://skyrising.github.io/mc-versions/schemas/version.json",
  "client": true,
  "downloads": {
    "client": {
      "sha1": "a040369aa294a5a42048d828b03592b54db6a8d3",
      "size": 16870823,
      "url": "https://launcher.mojang.com/v1/objects/a040369aa294a5a42048d828b03592b54db6a8d3/client.jar"
    },
    "server": {
      "sha1": "b2dc0522b0802cbb8e81d1afd3e46be8819d3c1d",
      "size": 34477549,
      "url": "https://launcher.mojang.com/v1/objects/b2dc0522b0802cbb8e81d1afd3e46be8819d3c1d/server.jar"
    }
  },
  "id": "18w43c",
  "manifests": [
    {
      "assetHash": "d6c94fad4f7a03a8e46083c023926515fc0e551e",
      "assetIndex": "1.14",
      "downloads": "dbd1df61f8c1f4647414da08f139279dbf674fe1",
      "downloadsId": 1,
      "hash": "f5ed0e423941499ade98c9fda9c9d73fe70dff4a",
      "time": "2018-10-26T08:40:46+00:00",
      "type": "snapshot",
      "url": "../manifest/f/5/ed0e423941499ade98c9fda9c9d73fe70dff4a/18w43c.json"
    },
    {
      "assetHash": "d6c94fad4f7a03a8e46083c023926515fc0e551e",
      "assetIndex": "1.14",
      "downloads": "dbd1df61f8c1f4647414da08f139279dbf674fe1",
      "downloadsId": 1,
      "hash": "cd658b49a18648e6ea9c56c311372151ca03e191",
      "time": "2018-10-26T08:40:46+00:00",
      "type": "snapshot",
      "url": "../manifest/c/d/658b49a18648e6ea9c56c311372151ca03e191/18w43c.json"
    },
    {
      "assetHash": "d6c94fad4f7a03a8e46083c023926515fc0e551e",
      "assetIndex": "1.14",
      "downloads": "dbd1df61f8c1f4647414da08f139279dbf674fe1",
      "downloadsId": 1,
      "hash": "c5adfd2fc8a0ca78975e16ede557d8c2e321929d",
      "time": "2018-10-26T08:40:46+00:00",
      "type": "snapshot",
      "url": "../manifest/c/5/adfd2fc8a0ca78975e16ede557d8c2e321929d/18w43c.json"
    },
    {
      "assetHash": "d6c94fad4f7a03a8e46083c023926515fc0e551e",
      "assetIndex": "1.14",
      "downloads": "dbd1df61f8c1f4647414da08f139279dbf674fe1",
      "downloadsId": 1,
      "hash": "5adf5d66e2a6e459e784d31aea61bf024da7101b",
      "time": "2018-10-26T08:40:46+00:00",
      "type": "snapshot",
      "url": "../manifest/5/a/df5d66e2a6e459e784d31aea61bf024da7101b/18w43c.json"
    }
  ],
  "next": [
    "18w44a"
  ],
  "normalizedVersion": "1.14.0-alpha.18.43.c",
  "previous": [
    "18w43b"
  ],
  "protocol": {
    "type": "netty",
    "version": 442
  },
  "releaseTarget": "1.14",
  "releaseTime": "2018-10-26T08:40:46+00:00",
  "server": true,
  "sharedMappings": true,
  "world": {
    "format": "anvil",
    "version": 1903
  }
}