{
  "client": true,
  "downloads": {
    "client": {
      "sha1": "9405570c459c0803da2754b34e5ffeb74413a904",
      "size": 15911764,
      "url": "https://launcher.mojang.com/v1/objects/9405570c459c0803da2754b34e5ffeb74413a904/client.jar"
    },
    "server": {
      "sha1": "71a2f9a760f0cbcf09d1eae60eebe1ccbb7ea1db",
      "size": 32612139,
      "url": "https://launcher.mojang.com/v1/objects/71a2f9a760f0cbcf09d1eae60eebe1ccbb7ea1db/server.jar"
    }
  },
  "id": "1.13-pre6",
  "manifests": [
    {
      "assetHash": "23981354446ddc141dcf03cc4bfa6b2a9492aa90",
      "assetIndex": "1.13",
      "downloads": "4242c9a02bcc79aebb15be0216d7fe4394123ed6",
      "downloadsId": 1,
      "hash": "873e32dca9d8c8350a7429ed46ac4418704351a2",
      "lastModified": "2021-12-15T15:55:36+00:00",
      "time": "2018-07-04T12:36:00+00:00",
      "type": "snapshot",
      "url": "../manifest/8/7/3e32dca9d8c8350a7429ed46ac4418704351a2/1.13-pre6.json"
    },
    {
      "assetHash": "23981354446ddc141dcf03cc4bfa6b2a9492aa90",
      "assetIndex": "1.13",
      "downloads": "4242c9a02bcc79aebb15be0216d7fe4394123ed6",
      "downloadsId": 1,
      "hash": "4b1f6e21d27350ebc98150511f11fd2ec7c63f8f",
      "lastModified": "2021-12-10T03:01:41+00:00",
      "time": "2018-07-04T12:36:00+00:00",
      "type": "snapshot",
      "url": "../manifest/4/b/1f6e21d27350ebc98150511f11fd2ec7c63f8f/1.13-pre6.json"
    },
    {
      "assetHash": "23981354446ddc141dcf03cc4bfa6b2a9492aa90",
      "assetIndex": "1.13",
      "downloads": "4242c9a02bcc79aebb15be0216d7fe4394123ed6",
      "downloadsId": 1,
      "hash": "e9b6efae99cf732242ae0cbdb5003dd555a2df40",
      "lastModified": "2021-07-07T13:59:16+00:00",
      "time": "2018-07-04T12:36:00+00:00",
      "type": "snapshot",
      "url": "../manifest/e/9/b6efae99cf732242ae0cbdb5003dd555a2df40/1.13-pre6.json"
    },
    {
      "assetHash": "23981354446ddc141dcf03cc4bfa6b2a9492aa90",
      "assetIndex": "1.13",
      "downloads": "4242c9a02bcc79aebb15be0216d7fe4394123ed6",
      "downloadsId": 1,
      "hash": "f1c6758e1219e212993f5db422100bca4eb68818",
      "lastModified": "2018-08-29T12:58:48+00:00",
      "time": "2018-07-04T12:36:00+00:00",
      "type": "snapshot",
      "url": "../manifest/f/1/c6758e1219e212993f5db422100bca4eb68818/1.13-pre6.json"
    }
  ],
  "next": [
    "1.13-pre7"
  ],
  "normalizedVersion": "1.13.0-pre.6",
  "previous": [
    "1.13-pre5"
  ],
  "protocol": {
    "type": "netty",
    "version": 388
  },
  "releaseTarget": "1.13",
  "releaseTime": "2018-07-04T12:36:00+00:00",
  "server": true,
  "sharedMappings": true,
  "world": {
    "format": "anvil",
    "version": 1512
  }
}